{
  "$schema": "https://json-schema.org/draft/2020-12/schema",
  "$id": "page_plan.schema.json",
  "type": "object",
  "additionalProperties": false,
  "required": ["schema_version", "product_slug", "launch_tier", "pages"],
  "properties": {
    "schema_version": { "type": "string" },
    "product_slug": { "type": "string" },
    "launch_tier": {
      "type": "string",
      "enum": ["minimal", "standard", "rich"],
      "description": "Final launch tier after adjustments"
    },
    "launch_tier_adjustments": {
      "type": "array",
      "description": "Log of tier adjustments with reasons",
      "items": {
        "type": "object",
        "additionalProperties": false,
        "required": ["adjustment", "reason"],
        "properties": {
          "adjustment": {
            "type": "string",
            "enum": ["elevated", "reduced", "unchanged"]
          },
          "from_tier": {
            "type": "string",
            "enum": ["minimal", "standard", "rich"]
          },
          "to_tier": {
            "type": "string",
            "enum": ["minimal", "standard", "rich"]
          },
          "reason": { "type": "string" },
          "signal": {
            "type": "string",
            "description": "Quality signal that triggered the adjustment"
          }
        }
      }
    },
    "inferred_product_type": {
      "type": "string",
      "enum": ["sdk", "library", "cli", "service", "plugin", "tool", "other"],
      "description": "Product type used for template selection"
    },
    "evidence_volume": {
      "type": "object",
      "description": "TC-983: Evidence volume metrics used for page scaling. Contains counts of claims, snippets, API symbols, workflows, and key features extracted from product_facts and snippet_catalog. Used by W4 to compute effective per-section quotas.",
      "additionalProperties": true
    },
    "effective_quotas": {
      "type": "object",
      "description": "TC-983: Effective per-section quotas after evidence scaling. Maps section names to their computed max_pages after applying tier coefficients and evidence-based targets. Used downstream by W7 for Gate 14 validation.",
      "additionalProperties": true
    },
    "pages": {
      "type": "array",
      "items": {
        "type": "object",
        "additionalProperties": false,
        "required": [
          "section",
          "slug",
          "output_path",
          "url_path",
          "title",
          "purpose",
          "required_headings",
          "required_claim_ids",
          "required_snippet_tags",
          "cross_links"
        ],
        "properties": {
          "section": { "enum": ["products", "docs", "reference", "kb", "blog"] },
          "slug": {
              "type": "string",
              "pattern": "^[a-z0-9_][a-z0-9_-]*[a-z0-9]$|^[a-z0-9_]$",
              "maxLength": 60,
              "description": "Page slug (Round 13: enforced via Slug Sanitization Contract)"
            },
          "output_path": {
            "type": "string",
            "description": "Content file path relative to site repo root"
          },
          "url_path": {
            "type": "string",
            "description": "Public canonical URL path (e.g., /cells/overview/)"
          },
          "absolute_url": {
            "type": "string",
            "description": "Absolute public URL for this page (e.g., https://docs.aspose.org/cells/overview/)"
          },
          "description": {
            "type": "string",
            "description": "Brief description of page content and purpose for SEO and navigation"
          },
          "title": {
              "type": "string",
              "maxLength": 120,
              "description": "Page title (SEO recommended ≤70 chars; hard limit 120)"
            },
          "purpose": { "type": "string" },
          "template_path": {
            "type": "string",
            "description": "Path to template file for template-driven pages (blog)"
          },
          "template_variant": {
            "type": "string",
            "description": "Template variant used (minimal/standard/rich)"
          },
          "required_headings": { "type": "array", "items": { "type": "string" } },
          "required_claim_ids": { "type": "array", "items": { "type": "string" } },
          "required_snippet_tags": { "type": "array", "items": { "type": "string" } },
          "cross_links": {
            "type": "array",
            "description": "Absolute URLs to related pages on other subdomains (e.g., https://docs.aspose.org/cells/overview/). Format: https://<subdomain>/<family>/<slug>/",
            "items": { "type": "string", "format": "uri" }
          },
          "seo_keywords": { "type": "array", "items": { "type": "string" } },
          "forbidden_topics": {
            "type": "array",
            "items": { "type": "string" },
            "description": "Topics/claims to explicitly avoid on this page"
          },
          "token_mappings": {
            "type": "object",
            "description": "TC-964: Token mappings for template-driven pages (blog). Maps placeholder tokens to actual values for frontmatter and body content.",
            "additionalProperties": { "type": "string" }
          },
          "page_role": {
            "type": "string",
            "enum": [
              "landing",
              "toc",
              "comprehensive_guide",
              "workflow_page",
              "feature_showcase",
              "troubleshooting",
              "api_reference",
              "faq",
              "best_practices",
              "tutorial",
              "howto_article",
              "blog_announcement",
              "feature_blog",
              "format_conversion",
              "performance_guide"
            ],
            "description": "TC-971: Strategic role of page in content architecture. Defines page purpose and content boundaries. Optional in Phase 1 for backward compatibility."
          },
          "content_strategy": {
            "type": "object",
            "description": "TC-971: Content distribution and overlap prevention rules. Optional in Phase 1 for backward compatibility.",
            "additionalProperties": false,
            "properties": {
              "primary_focus": {
                "type": "string",
                "description": "What this page is about (1-2 sentences)"
              },
              "forbidden_topics": {
                "type": "array",
                "items": { "type": "string" },
                "description": "Topics/concepts to explicitly avoid on this page"
              },
              "claim_quota": {
                "type": "object",
                "description": "Minimum and maximum claims allowed on this page",
                "additionalProperties": false,
                "properties": {
                  "min": {
                    "type": "number",
                    "minimum": 0,
                    "description": "Minimum claims required"
                  },
                  "max": {
                    "type": "number",
                    "minimum": 0,
                    "description": "Maximum claims allowed"
                  }
                }
              },
              "child_pages": {
                "type": "array",
                "items": { "type": "string" },
                "description": "For TOC pages: slugs of child pages to list"
              },
              "scenario_coverage": {
                "type": "string",
                "enum": ["single", "all", "subset"],
                "description": "For comprehensive_guide: 'all' means must cover all workflows from product_facts"
              },
              "avoid_overlap_with": {
                "type": "array",
                "items": { "type": "string" },
                "description": "Page slugs whose content this page should not duplicate"
              },
              "content_approach": {
                "type": "string",
                "description": "Recommended approach for writing this page content"
              },
              "tone": {
                "type": "string",
                "description": "Tone and style guidance for this page (e.g., instructional, reference, conversational)"
              },
              "unique_angle": {
                "type": "string",
                "description": "Unique angle or value proposition differentiating this page from related ones"
              }
            }
          },
          "page_status": {
            "type": "string",
            "enum": ["new", "preserved", "updated", "deleted"],
            "description": "Round 12: Incremental page status. 'new'=first run, 'preserved'=reused from previous, 'updated'=regenerated, 'deleted'=removed."
          },
          "related_pages": {
            "type": "array",
            "description": "Round 12: Cross-page links from claim overlap detection. Top 3 pages with most overlapping claims.",
            "items": {
              "type": "object",
              "additionalProperties": false,
              "required": ["slug", "section"],
              "properties": {
                "slug": {
                  "type": "string",
                  "description": "Slug of the related page"
                },
                "section": {
                  "type": "string",
                  "description": "Section of the related page"
                },
                "overlap_score": {
                  "type": "number",
                  "minimum": 0.0,
                  "maximum": 10.0,
                  "description": "Claim overlap score (Jaccard or weighted; observed values up to 4.0)"
                }
              }
            }
          },
          "preservation_metadata": {
            "type": "object",
            "description": "Round 12: Metadata for incremental page preservation decisions.",
            "additionalProperties": false,
            "properties": {
              "previous_page_id": {
                "type": "string",
                "description": "Page identifier from previous run (section:slug)"
              },
              "claim_overlap_score": {
                "type": "number",
                "minimum": 0.0,
                "maximum": 1.0,
                "description": "Jaccard similarity of claim IDs between old and new page"
              },
              "should_preserve": {
                "type": "boolean",
                "description": "Whether this page should be preserved (reuse previous content)"
              },
              "previous_run_id": {
                "type": "string",
                "description": "Run ID of the previous run this page came from"
              }
            }
          }
        }
      }
    }
  }
}
